InputText,Relationships,SectorData,MetaData
"ClariVest Asset Management, LLC, an affiliate of Carillon Tower Advisers, Inc., released the “Carillon Clarivest Capital Appreciation Fund” third quarter 2023 investor letter. A copy of the same can be downloaded here. The third quarter of 2023 began strongly in July, but the equity markets were unable to withstand the ongoing upward momentum in interest rates, and many indexes ended the quarter in the negative. When compared to the Russell 1000 Growth Index at the beginning of the quarter, the fund was most underweight in communication and consumer discretionary services and most overweight in the information technology and healthcare sectors. By the end of the quarter, the portfolio remained the most underweight consumer discretionary and consumer staples and most overweight information technology and healthcare. In addition, please check the fund’s top five holdings to know its best picks in 2023.

Carillon Clarivest Capital Appreciation Fund highlighted stocks like NVIDIA Corporation (NASDAQ:NVDA) in the third quarter 2023 investor letter. Headquartered in Santa Clara, California, NVIDIA Corporation (NASDAQ:NVDA) provides computer graphics processors, chipsets, and related multimedia software. On December 7, 2023, NVIDIA Corporation (NASDAQ:NVDA) stock closed at $465.96 per share. One-month return of NVIDIA Corporation (NASDAQ:NVDA) was -3.60%, and its shares gained 174.08% of their value over the last 52 weeks. NVIDIA Corporation (NASDAQ:NVDA) has a market capitalization of $ 1.151 trillion.

Carillon Clarivest Capital Appreciation Fund made the following comment about NVIDIA Corporation (NASDAQ:NVDA) in its Q3 2023 investor letter:

""During the third quarter of 2023, an underweight to real estate and an overweight to healthcare helped performance, while an overweight to information technology and an underweight to energy detracted. Stock selection was strong within information technology and consumer staples but was weak within financials and communication services. NVIDIA Corporation (NASDAQ:NVDA) designs, develops and markets 3D graphics processors and related software. The company also expanded its partnership with Google Cloud to advance AI computing, software and services.""

Story continues

A close-up of a colorful high-end graphics card being plugged in to a gaming computer.

NVIDIA Corporation (NASDAQ:NVDA) is in 17th position on our list of 30 Most Popular Stocks Among Hedge Funds. As per our database, 180 hedge fund portfolios held NVIDIA Corporation (NASDAQ:NVDA) at the end of third quarter which was 175 in the previous quarter.

We discussed NVIDIA Corporation (NASDAQ:NVDA) in another article and shared Cliff Asness' top stock picks. In addition, please check out our hedge fund investor letters Q3 2023 page for more investor letters from hedge funds and other leading investors.

Suggested Articles:

Disclosure: None. This article is originally published at Insider Monkey.",,"{""SECTOR"": [""Technology"", ""Healthcare"", ""Consumer Discretionary"", ""Consumer Staples"", ""Energy""], ""PEOPLE"": [""Cliff Asness""], ""PRODUCTS"": [""N/A (No specific products were mentioned)""]}","{""title"": ""What Makes NVIDIA Corporation (NVDA) a Strong Long-Term Bet?"", ""publisher"": ""Yahoo Finance"", ""authors"": ""Soumya Eswaran"", ""published_date"": NaN}"
"The latest trading session saw Nvidia (NVDA) ending at $412.31, denoting a +1.81% adjustment from its last day's close. This change outpaced the S&P 500's 1.2% gain on the day. Elsewhere, the Dow gained 1.58%, while the tech-heavy Nasdaq added 1.16%.

Coming into today, shares of the maker of graphics chips for gaming and artificial intelligence had lost 6.89% in the past month. In that same time, the Computer and Technology sector lost 3.32%, while the S&P 500 lost 3.58%.

Market participants will be closely following the financial results of Nvidia in its upcoming release. The company plans to announce its earnings on November 21, 2023. The company is forecasted to report an EPS of $3.34, showcasing a 475.86% upward movement from the corresponding quarter of the prior year. Meanwhile, the Zacks Consensus Estimate for revenue is projecting net sales of $16.12 billion, up 171.72% from the year-ago period.

For the full year, the Zacks Consensus Estimates are projecting earnings of $10.74 per share and revenue of $54.4 billion, which would represent changes of +221.56% and +101.69%, respectively, from the prior year.

Investors should also take note of any recent adjustments to analyst estimates for Nvidia. These revisions help to show the ever-changing nature of near-term business trends. Therefore, positive revisions in estimates convey analysts' confidence in the company's business performance and profit potential.

Our research demonstrates that these adjustments in estimates directly associate with imminent stock price performance. We developed the Zacks Rank to capitalize on this phenomenon. Our system takes these estimate changes into account and delivers a clear, actionable rating model.

The Zacks Rank system ranges from #1 (Strong Buy) to #5 (Strong Sell). It has a remarkable, outside-audited track record of success, with #1 stocks delivering an average annual return of +25% since 1988. Within the past 30 days, our consensus EPS projection has moved 0.81% higher. At present, Nvidia boasts a Zacks Rank of #1 (Strong Buy).

Story continues

Looking at its valuation, Nvidia is holding a Forward P/E ratio of 37.7. Its industry sports an average Forward P/E of 18.17, so one might conclude that Nvidia is trading at a premium comparatively.

One should further note that NVDA currently holds a PEG ratio of 2.79. The PEG ratio is akin to the commonly utilized P/E ratio, but this measure also incorporates the company's anticipated earnings growth rate. As the market closed yesterday, the Semiconductor - General industry was having an average PEG ratio of 2.47.

The Semiconductor - General industry is part of the Computer and Technology sector. This industry, currently bearing a Zacks Industry Rank of 77, finds itself in the top 31% echelons of all 250+ industries.

The strength of our individual industry groups is measured by the Zacks Industry Rank, which is calculated based on the average Zacks Rank of the individual stocks within these groups. Our research shows that the top 50% rated industries outperform the bottom half by a factor of 2 to 1.

Don't forget to use Zacks.com to keep track of all these stock-moving metrics, and others, in the upcoming trading sessions.

Want the latest recommendations from Zacks Investment Research? Today, you can download 7 Best Stocks for the Next 30 Days. Click to get this free report

NVIDIA Corporation (NVDA) : Free Stock Analysis Report

To read this article on Zacks.com click here.

Zacks Investment Research","(technology, product manufacturer, nvidia)
(nvidia, supplier-customer, nasdaq)
(nvidia, manufacturer, graphics chips for gaming and artificial intelligence)","{""SECTOR"": [""Technology"", ""Computer and Technology"", ""Semiconductor - General"", ""Computer and Technology sector""], ""COMPANY"": [""Nvidia (NVDA)"", ""Dow"", ""Nasdaq"", ""S&P 500""], ""PEOPLE"": [], ""PRODUCTS"": [""graphics chips for gaming and artificial intelligence"", ""Semiconductor - General industry"", ""Forward P/E ratio"", ""PEG ratio""]}","{""title"": ""Nvidia (NVDA) Beats Stock Market Upswing: What Investors Need to Know"", ""publisher"": ""Yahoo Finance"", ""authors"": ""Zacks Equity Research"", ""published_date"": NaN}"
"Amid the dynamic upswing in global semiconductor demand propelled by technological leaps and integrations, I evaluated two prominent semiconductor stocks, NVIDIA Corporation (NVDA) and Broadcom Inc. (AVGO), to ascertain which holds the potential to yield superior returns this month. Let’s understand this in detail.

The semiconductor demand stands resilient, affirmed by the Semiconductor Industry Association (SIA). The global semiconductors sales in October amounted to $46.6 billion, up 3.9% over September’s $44.9 billion. Moreover, worldwide semiconductor sales totaled $134.7 billion in the third quarter of 2023, a 6.3% rise from the second quarter.

The surge in demand for high-performance GPU-based servers and accelerator cards within data centers, propelled by advancements in generative AI (GenAI) and large language models, constitutes a significant driver of growth in the semiconductor industry.

The memory market, which is predicted to grow by more than 40% year-over-year to more than $130 billion in 2024, is the primary engine of the industry’s expected growth. Other significant areas, such as discrete, sensors, analog, logic, and micro, are expected to grow in the single digits simultaneously.

Demand will rise further as a result of the ongoing development and integration of technologies such as 5G, AI, and the Internet of Things (IoT) in various industries. According to Gartner (IT), global semiconductor revenue will climb 16.8% to $624 billion in 2024.

Furthermore, as per a report by Mordor Intelligence, the semiconductor industry is expected to reach $1.09 trillion by 2028, rising at a CAGR of 10.9%.

In terms of price performance, NVDA has marginally declined over the past month, while AVGO gained 2.6% during the same period. Moreover, NVDA witnessed a 3.3% plunge over the past three months, while AVGO climbed by 3.6% over the same duration.

However, NVDA has surged 184.6% over the past year, closing the last trading session at $455.03, whereas AVGO has gained 71.9% during the same period, closing the last trading session at $903.64.

But which Semiconductor & Wireless Chip stock could be a better pick? Let’s find out.

Recent Financial Results

For the fiscal 2024 third quarter that ended October 29, 2023, NVDA’s non-GAAP revenue increased 205.5% year-over-year to $18.12 billion. Its non-GAAP net income and non-GAAP EPS grew 588.2% and 593.1% from the prior year’s period to $10.02 billion and $4.02, respectively.

However, as of October 29, 2023, the company’s current liabilities amounted to $9.10 billion, compared to $6.56 billion as of January 29, 2023.

For the fiscal third quarter that ended July 30, 2023, AVGO’s non-GAAP net revenue grew 4.9% year-over-year to $8.88 billion. Its adjusted EBITDA rose 7.9% from the year-ago value to $5.80 billion. Also, the company’s non-GAAP net income and non-GAAP EPS grew 8.4% and 8.3% from the prior year’s period to $4.60 billion and $10.54, respectively.

Past and Expected Financial Performance

Over the past three years, NVDA’s revenue and EBITDA increased at 44.8% and 63.3% CAGR, respectively. Its net income and EPS grew at respective CAGRs of 70.3% and 70.5%, respectively. In addition, the company’s levered free cash flow rose at a 63.8% CAGR during the same period.

Analysts expect NVDA’s revenue to grow 231.1% year-over-year to $20.03 billion for the fourth quarter of fiscal year 2024, ending January 2024. In addition, the company’s EPS is expected to grow 411.2% from the prior year’s period to $4.50.

Over the past three years, AVGO’s revenue and EBITDA rose at a CAGR of 15.2% and 24.7%, respectively. Its net income and EPS grew 77.6% and 83.2% during the same period. Moreover, the company’s levered free cash flow increased at a CAGR of 6.9% during the same time frame.

For the fiscal fourth quarter ending October 2023, AVGO’s revenue is expected to increase 3.9% year-over-year to $9.28 billion. Similarly. the company’s EPS for the ongoing period is expected to be $10.96, up 4.9% from the previous year’s quarter.

Valuation

In terms of forward P/E, AVGO is trading at 27.05x, 33.6% lower than NVDA, which is trading at 40.74x. Moreover, AVGO’s forward EV/Sales of 11.18x is 41.1% lower than NVDA’s 18.97x. In addition, AVGO’s forward EV/EBITDA of 17.45x compares with NVDA’s 33.79x.

Profitability

NVDA’s trailing-12-month revenue is 1.3 times that of what AVGO generates. However, AVGO is more profitable, with a trailing-12-month gross profit margin of 74.27%, compared to NVDA’s 69.85%. Additionally, AVGO’s trailing-12-month EBITDA margin and levered FCF margin of 57.34% and 38.97% compare with NVDA’s 49.39% and 31.46%, respectively.

POWR Ratings

NVDA has an overall rating of C, which equates to a Neutral in our proprietary POWR Ratings system. Conversely, AVGO has an overall rating of B, translating to a Buy. The POWR Ratings are calculated considering 118 different factors, with each factor weighted to an optimal degree.

Our proprietary rating system also evaluates each stock based on eight distinct categories. NVDA has a B grade for Quality. Its trailing-12-month EBITDA margin and levered FCF margin of 49.39% and 31.46% are 434% and 287.5% higher than the industry averages of 9.25% and 8.12%, respectively.

On the other hand, AVGO has an A grade for Quality, justified by its better profitability metrics. The stock’s trailing-12-month EBITDA margin and levered FCF margin of 57.34% and 38.97% are 520% and 380% higher than the industry averages of 9.25% and 8.12%, respectively.

In addition, NVDA has a D grade for Stability, justified by its 60-month beta of 1.69. In comparison, AVGO has a B grade for Stability, consistent with its 60-month beta of 1.12.

Of the 91 stocks in the Semiconductor & Wireless Chip industry, NVDA is ranked #29, while AVGO is ranked #13.

Beyond what we’ve stated above, we have also rated both stocks for Growth, Value, Momentum, and Sentiment. Click here to view NVDA’s ratings. Get all AVGO ratings here.

The Winner

Given the robust demand for semiconductors fueled by technological advancements and integration, both NVDA and AVGO are poised to capitalize on the sector’s growth. Nevertheless, AVGO’s superior financial performance, heightened profitability, and discounted valuation make it a more favorable investment choice over NVDA this month.

Our research shows that the odds of success increase when one invests in stocks with an overall rating of Strong Buy. View all the top-rated stocks in the Semiconductor & Wireless Chip industry here.

What To Do Next?

Discover 10 widely held stocks that our proprietary model shows have tremendous downside potential. Please make sure none of these “death trap” stocks are lurking in your portfolio:

10 Stocks to SELL NOW! >

NVDA shares were trading at $462.05 per share on Thursday afternoon, up $7.02 (+1.54%). Year-to-date, NVDA has gained 216.31%, versus a 21.07% rise in the benchmark S&P 500 index during the same period.

About the Author: Aanchal Sugandh

Aanchal's passion for financial markets drives her work as an investment analyst and journalist. She earned her bachelor's degree in finance and is pursuing the CFA program. She is proficient at assessing the long-term prospects of stocks with her fundamental analysis skills. Her goal is to help investors build portfolios with sustainable returns. More...

More Resources for the Stocks in this Article","(technology, product manufacturer, nvidia)
(semiconductor industry, regulatory body, semiconductor industry association)
(semiconductor industry, market leader, nvidia)
(nvidia, supplier-customer, mordor intelligence)
(broadcom inc., supplier-customer, mordor intelligence)
(nvidia, manufacturer, gpu-based servers)
(nvidia, manufacturer, accelerator cards)
(broadcom inc. (avgo), manufacturer, 5g)
(broadcom inc. (avgo), manufacturer, ai)
(broadcom inc. (avgo), manufacturer, internet of things(iot))","{""SECTOR"": [""Technology"", ""Semiconductor Industry""], ""COMPANY"": [""NVIDIA Corporation (NVDA)"", ""Broadcom Inc. (AVGO)"", ""Semiconductor Industry Association (SIA)"", ""Mordor Intelligence""], ""PEOPLE"": [], ""PRODUCTS"": [""GPU-based servers"", ""accelerator cards"", ""generative AI (GenAI)"", ""large language models"", ""5G"", ""AI"", ""Internet of Things (IoT)""]}","{""title"": ""Which Semiconductor Stock Will Lead in December?"", ""publisher"": ""StockNews.com"", ""authors"": NaN, ""published_date"": NaN}"
"This morning, financial news channels are all giving extensive coverage to the event held yesterday by Advanced Micro Devices (AMD) to present their new MI300X microchip. The standard take is that it will take a lot of business away from Nvidia (NVDA), whose status as the lone supplier of chips suitable for developing AI platforms has been responsible for that stock posting gains of well over 200% this year. So, is the news good or bad for AMD, good or bad for NVDA, or some combination of those things?

Maybe it is just the arrogance of someone who has worked in and around financial markets for forty years or so, but I believe that if you want an answer as to how any news or development is going to impact a company, the best thing to do is to look at how its stock performs once the information becomes public. On that basis, AMD getting into the rapidly expanding market for AI capable chips isn’t necessarily bad news for NVDA. The development of the MI300X was first announced back in June. Since then, NVDA has continued to show gains.

The above chart shows the performance of NVDA (blue line) and AMD (green line) over the last six months. As you can see, the announcement that AMD was developing a chip to compete with Nvidia has not really held back NVDA, which has gained over 20% over the period, nor has it really helped AMD, which has been basically flat. One assumes that that is a result of skepticism from traders and investors about whether AMD’s offering would prove to be a real competitor to NVDA. Maybe, given the difficulty of developing and manufacturing these chips, there was even some doubt that AMD would actually be able to make something that was a serious competitor.

What we learned yesterday is that the development program has been a success, and that AMD believes that they have a decent product. That view was supported by the news that some big customers, such as Meta (META) and Microsoft (MSFT) have said that they would be open to using the MI300X. So, can we expect AMD to make rapid gains from here at the expense of NVDA?

That would definitely be the case if this were a zero sum game, but it isn’t. The market for AI capable chips is expanding so rapidly that there was never going to be only one manufacturer for any length of time. During the event the AMD CEO, Lisa Su, forecast that that market would reach in excess of $400 billion by 2027. If she is correct, competition for Nvidia was not just inevitable, but is actually necessary if demand is to be met.

The market knows this, of course, and has factored it into the current pricing of NVDA. Even if we assume that Su’s forecast is off by $100 billion, that still leaves a market of $300 billion in four years, and Nvidia’s revenue for fiscal year 2023 was just under $27 billion. That means even if the MI300X is wildly successful and grabs half the market, Nvidia’s revenue will still grow by around $123 billion by 2027. Using a more conservative number than the AMD CEO, there appears to still be plenty of upside for NVDA, that is currently trading at a forward P/E of 41.6 based on analysts’ estimates for 2024, and 25.1 for 2025.

AMD’s forward P/Es, at 60.8 and 40.4 for those years look a bit less attractive, but if the new generation of chips is even moderately successful, their revenue, which is currently roughly equal to NVDA’s, is about to enter a period of rapid growth, so the forecasts on which those numbers are based will prove to be underestimates and that stock, too, will have a big upside.

As I write on Thursday morning, it seems that traders agree with the view that the most important thing about yesterday’s event was Su’s bullish estimate of the growth in the market for AI capable chips, growth which leaves room for both AMD and NVDA to post further gains. You might think that what looks like a successful launch of a competitor’s product would hurt NVDA, but both stocks are up in early trading. That tells investors who trust the market to get it right most of the time all they need to know.

The views and opinions expressed herein are the views and opinions of the author and do not necessarily reflect those of Nasdaq, Inc.","(nvidia, product manufacturer, mi300x)
(meta, consumer, mi300x)
(microsoft, consumer, mi300x)
(amd, supplier-customer, meta)
(amd, supplier-customer, microsoft)
(meta, customers, microsoft)
(amd, manufacturer, mi300x microchip)
(nvidia, competitors, amd)","{""SECTOR"": [""Technology""], ""COMPANY"": [""Advanced Micro Devices (AMD)"", ""Nvidia (NVDA)"", ""Meta (META)"", ""Microsoft (MSFT)""], ""PEOPLE"": [""Lisa Su""], ""PRODUCTS"": [""MI300X microchip"", ""AI capable chips""]}","{""title"": ""How Will AMD's New AI Chip Impact Nvidia's (NVDA) Stock?"", ""publisher"": ""Nasdaq"", ""authors"": NaN, ""published_date"": NaN}"
"Claret Asset Management, an investment management firm, released its third quarter 2023 investor letter, a copy of which can be downloaded here. As indicated by the fund, following the second-best first half of the century, the market bulls faced challenges in the third quarter of 2023. The S&P 500 recorded a loss of 3.27% in the three months ending September 30th, 2023. Analysts attribute this downturn to the surge in interest rates stemming from the Federal Reserve's measures to control inflation. The Canadian market fared slightly better, experiencing a loss of only 2.7% during the quarter. Take a moment to review the fund's top 5 holdings to gain insights into their primary investment choices for 2023.

In its Q3 2023 investor letter, Claret Asset Management mentioned NVIDIA Corporation (NASDAQ:NVDA) and explained its insights for the company. NVIDIA Corporation (NASDAQ:NVDA) is a Santa Clara, California-based multinational technology company with a $1.1 trillion market capitalization. NVIDIA Corporation (NASDAQ:NVDA) delivered a 218.64% return since the beginning of the year, while its 12-month returns are up by 191.27%. The stock closed at $465.66 per share on December 05, 2023.

Here is what Claret Asset Management has to say about NVIDIA Corporation (NASDAQ:NVDA) in its Q3 2023 investor letter:

""We have mentioned in the last letter that the “magnificent seven”, including NVIDIA Corporation,dominated the performance of the S&P 500. We might have left you with the feeling that we are bearish because we don’t find the Magnificent 7 attractive. Let us make it clear: we are just not so pessimistic as to believe there are only 7 growth opportunities in the entire global equity market. In fact, we are optimists and think opportunity is abundant. Just not in everyone’s current 7 favorite stocks.""

caspar-camille-rubin-N_lrIeCWgw0-unsplash

Our calculations show that NVIDIA Corporation (NASDAQ:NVDA) does not belong on our list of the 30 Most Popular Stocks Among Hedge Funds. We also mentioned NVIDIA Corporation (NASDAQ:NVDA) in another article. NVIDIA Corporation (NASDAQ:NVDA) was in 180 hedge fund portfolios at the end of the second quarter of 2023, compared to 175 funds in the previous quarter. NVIDIA Corporation (NASDAQ:NVDA) delivered a -4.08% return in the past 3 months. You can find other investor letters from hedge funds and prominent investors on our hedge fund investor letters Q3 2023 page.

Story continues

Suggested Articles:

Disclosure: None. This article is originally published at Insider Monkey.","(nvidia, product manufacturer, technology)
(claret asset management, investor-investee, nvidia)","{""SECTOR"": [""Technology""], ""COMPANY"": [""Claret Asset Management"", ""NVIDIA Corporation""], ""PEOPLE"": [], ""PRODUCTS"": []}","{""title"": ""Would You Still Dare to Invest in NVIDIA Corporation (NVDA)?"", ""publisher"": ""Yahoo Finance"", ""authors"": ""Jose Karlo Mari Tottoc"", ""published_date"": NaN}"
