InputText,Relationships,SectorData,MetaData
"Nvidia (NVDA), a giant in data centers and gaming, is supercharging investor interest in artificial intelligence. Is Nvidia stock a buy?

X

Semiconductor, AI News

On Dec. 6, AMD (AMD) released a new AI chip, offering new competition to Nvidia in the huge, fast-growing market.

In November, Nvidia delivered another quarterly earnings beat-and-raise report. It also unveiled the H200, its latest graphics processing unit for training AI models.

The AI chip leader has suffered recently from reports that the U.S. will move to crack down on redesigned Nvidia AI (artificial intelligence) chips, which were intended to get around export controls.

Companies like Nvidia, AMD and Microsoft (MSFT) tap the emerging market for generative AI. Generative AI can create content, including written articles, from simple phrases by analyzing vast amounts of data. It can also write programming code.

For those looking for the top large-cap stocks to buy now, here's a dive into NVDA.

Nvidia Stock Technical Analysis

The AI chip leader broke out past a 476.09 buy point from a double-bottom base in early November, reaching a record 505.48 on Nov. 20. However, the advance from the Oct. 31 low came on light volume, the IBD MarketSmith chart shows.

The stock stumbled after Nvidia's Nov. 21 earnings report, falling back below the buy point and 21-day line. But it has found recent support at the 50-day line.

If NVDA stock gets back above the entry, the buy zone would go to 499.89, according to IBD Leaderboard.

Nvidia stock tested the still-valid 476.09 buy point on Dec. 8, but closed below it.

The relative strength line for Nvidia stock is starting to show some lag after rallying for most of 2023. A rising RS line, the blue line in IBD charts, shows that a stock is outperforming the S&P 500.

After a painful 2022, NVDA stock has soared more than 223% year to date. It mostly held up better than growth stocks at large during recent market sell-offs.

Nvidia joined IBD Leaderboard after gapping up on earnings in February.

NVDA earns an IBD Composite Rating of 98 out of 99. In other words, Nvidia stock is in the top 2% of all stocks in terms of technical and fundamental metrics.

Investors generally should focus on stocks with Comp Ratings of 90 or even 95 and above. Nvidia stock often earns a spot on the IBD 50, Big Cap 20 and Sector Leaders lists.

The IBD Stock Checkup tool shows that NVDA carries a Relative Strength Rating of 97. That means it has outperformed 97% of all other stocks over the past year.

The iShares PHLX Semiconductor ETF (SOXX) holds both Nvidia stock and AMD stock.

IBD Live: A New Tool For Daily Stock Market Analysis

Nvidia Earnings

Nvidia's EPS Rating is a perfect 99 and its SMR Rating is an A, on a scale of A to a worst E. The EPS rating compares a company's earnings growth to other stocks. Its SMR Rating gauges sales growth, profit margins and return on equity.

On Nov. 21, Nvidia disclosed earnings rocketed 593% in the third quarter and revenue soared 206%, an overall beat.

Nvidia earnings accelerated from a 429% gain the prior quarter. Sales growth also sped up sharply from the previous quarter. The chip giant guided Q4 sales of $20 billion, up 231%.

In Q3, data-center revenue surged 279%. The business includes the A100 and H100 AI chips.

For the full year, analysts now expect Nvidia earnings to rebound 264% as sales jump 118%. Last year, Nvidia earnings fell 25% per share.

Out of 54 analysts covering NVDA stock, 51 rate it a buy. Three have a hold and no one has a sell, according to FactSet.

Looking For The Next Big Stock Market Winners? Start With These 3 Steps

NVDA Backstory, Rivals

The fabless chipmaker pioneered graphics processing units, or GPUs, to make video games more realistic. It's expanding in AI chips, used in supercomputers, data centers and drug development.

Nvidia's GPUs act as accelerators for central processing units, or CPUs, made by other companies. It's working on ""supercomputers"" combining its own CPUs and GPUs.

In addition, Nvidia chips are used for Bitcoin mining and self-driving electric cars.

Nvidia has made a big push into metaverse applications.

Fabless chip stocks include Qualcomm (QCOM), Broadcom (AVGO) and Monolithic Power Systems (MPWR).

Currently, the fabless group ranks No. 92 out of 197 industry groups. Fabless companies design the hardware while outsourcing the manufacturing to a third-party firm.

For the best returns, investors should focus on companies that are leading the market and their own industry group.

Is Nvidia Stock A Buy?

On a fundamental level, Nvidia is poised for explosive growth. Earnings should more than triple this fiscal year, driven by booming chip sales for data centers and artificial intelligence.

The fabless chipmaker is expanding in other growth areas, such as automated electric cars, cloud gaming and the metaverse as well.

But AI competition is intensifying. Macroeconomic uncertainties linger. Geopolitical risks are also rife, from the U.S.-China trade war to actual war in Ukraine and Israel.

NVDA stock has staged a massive comeback, more than tripling in 2023 so far. Nvidia came under pressure after its latest earnings report. Shares are now rebounding from a key level, with the AI chip stock flirting with the buy point again.

Bottom line: Nvidia stock is not a buy right now, but it could be soon. As a chip company with exposure to top growth markets, NVDA is always one to watch.

Check out IBD Stock Lists and other IBD content to find dozens of the best stocks to buy or watch.

YOU MAY ALSO LIKE:

See The Best Stocks To Buy And Watch

Catch The Next Big Winning Stock With MarketSmith

Join IBD Live And Learn Top Chart-Reading And Trading Techniques From The Pros

","(technology, product manufacturer, nvidia)
(technology, product manufacturer, amd)
(technology, product manufacturer, microsoft)
(amd, competitors, nvidia)
(microsoft, collaborators, nvidia)
(nvidia, manufacturer, graphics processing unit (gpu)
(nvidia, manufacturer, ai chips)
(nvidia, manufacturer, a100 and h100 ai chips)
(nvidia, manufacturer, cpus)
(nvidia, manufacturer, bitcoin mining)
(nvidia, manufacturer, self-driving electric cars)
(nvidia, manufacturer, metaverse applications)
(nvidia, manufacturer, gaming)
(amd, manufacturer, ai chips)
(microsoft, designer/developer, ai chips)
(microsoft, designer/developer, metaverse applications)
(microsoft, designer/developer, gaming)","{""SECTOR"": [""Technology""], ""COMPANY"": [""Nvidia (NVDA)"", ""AMD"", ""Microsoft (MSFT)"", ""iShares PHLX Semiconductor ETF (SOXX)""], ""PEOPLE"": [], ""PRODUCTS"": [""data centers"", ""graphics processing unit (GPU)"", ""AI chips"", ""A100 and H100 AI chips"", ""CPUs"", ""Bitcoin mining"", ""self-driving electric cars"", ""metaverse applications"", ""gaming""]}","{""title"": ""Nvidia Stock Tests Buy Point After Finding Key Support — Is AI Chip Leader A Buy In December 2023?"", ""publisher"": ""Investor's Business Daily"", ""authors"": ""Investor'S Business Daily"", ""published_date"": ""2023-12-08""}"
"Blue Tower Asset Management, an investment Management Company, released its third quarter, 2023 investor letter. A copy of the same can be downloaded here. In the quarter, the Blue Tower Global Value had a -2.19% return net of fees (-1.94% gross). The rates on US government treasuries rose sharply this quarter as the Federal Reserve pushed back their predictions for interest rate decreases. This drop in long-term bond prices triggered a selloff in equity markets. In addition, you can check the top 5 holdings of the fund to know its best picks in 2023.

Blue Tower Asset Management highlighted stocks like NVVIDIA Corporation (NASDAQ:NVDA) in the third quarter 2023 investor letter. Headquartered in Santa Clara, California, NVIDIA Corporation (NASDAQ:NVDA) provides computer graphics processors, chipsets, and related multimedia software. On December 19, 2023, NVIDIA Corporation (NASDAQ:NVDA) stock closed at $496.04 per share. One-month return of NVIDIA Corporation (NASDAQ:NVDA) was -0.68%, and its shares gained 208.39% of their value over the last 52 weeks. NVIDIA Corporation (NASDAQ:NVDA) has a market capitalization of $1.225 trillion.

Blue Tower Asset Management made the following comment about NVIDIA Corporation (NASDAQ:NVDA) in its Q3 2023 investor letter:

""In addition to the use of larger datasets, the training speed of AI models has increased dramatically. NVIDIA Corporation (NASDAQ:NVDA)’s stock almost tripled in the first 3 quarters of this year with a 197% gain, and a large reason for this is the huge role they have played in recent AI improvements. Nvidia’s single GPU AI training speed performance has increased by a dramatic 1000x in 10 years with only 2.5x coming from Moore’s Law3 driven increases in chip density. Besides better chip manufacturing, there were three other improvement factors at play: simplifications in number representation for the weights of the neural networks, more complex mathematical instructions for reducing the computational overhead involved in mathematical calculations, and increased neuron sparsity (in neural networks, some neurons are useless and can be pruned from the network without reducing performance significantly). In addition to these single GPU improvements, Nvidia also made improvements in data center scale architecture that allows groups of GPUs to work more efficiently together. It is noteworthy that the vast majority of the improvement came from hardware architectural and software data improvements, rather than transition density. These improvements were likely the low-hanging fruit of training speed improvements as researchers will eventually converge on an ideal architecture. The simplification of going from 32-bit to 8-bit floating point numbers for measuring weights is a one-time gain that can’t be repeated again. I expect the rate of improvement to slow down over the next ten years and eventually approach the levels of Moore’s Law improvements in chip efficiency. The historical trend for computer hardware is for it to eventually be commoditized, and I believe this will eventually occur for Nvidia’s GPUs as well.""

Story continues

Nvidia, Software

Photo by Christian Wiediger on Unsplash

NVIDIA Corporation (NASDAQ:NVDA) is in 17th position on our list of 30 Most Popular Stocks Among Hedge Funds. As per our database, 180 hedge fund portfolios held NVIDIA Corporation (NASDAQ:NVDA) at the end of third quarter which was 175 in the previous quarter.

We discussed NVIDIA Corporation (NASDAQ:NVDA) in another article and shared the list of best Roth IRA stocks to buy according to hedge funds. In addition, please check out our hedge fund investor letters Q3 2023 page for more investor letters from hedge funds and other leading investors.

Suggested Articles:

Disclosure: None. This article is originally published at Insider Monkey.",,"{""SECTOR"": [""Technology""], ""PEOPLE"": [], ""PRODUCTS"": [""Blue Tower Global Value"", ""computer graphics processors"", ""chipsets"", ""multimedia software"", ""GPU AI training speed performance"", ""32-bit to 8-bit floating point numbers"", ""Roth IRA stocks""]}","{""title"": ""NVIDIA Corporation (NVDA) Stock Tripled in 2023"", ""publisher"": ""Yahoo Finance"", ""authors"": ""Soumya Eswaran"", ""published_date"": NaN}"
"Can they beat expectations again?

Nvidia is set to report quarterly earnings on Nov. 21 after the stock market closes at 3:20 CDT.

They are expected to report an earnings-per-share (EPS) of $3.39 on $16.11 billion in revenue.

The EPS figure is significantly higher this quarter compared to last quarter's expectation of $2.07 per share.

The revenue figure is significantly higher this quarter compared to last quarter's expectation of $11.09 billion.

Nvidia earnings preview

If you're reading this article, you probably already know that Nvidia (NVDA) has had a stellar 2023. The tech stock opened the year at $210.00, and reached its new all time high of $504.60 today, Nov. 20.

Nvidia has been the darling of the artificial intelligence craze, spiking almost $100 after their earnings announcement in May 2023. The stock has rallied almost $100 this month alone, and there are big expectations for the stock this earnings season. I was shocked to see just how much the EPS and revenue figures have increased compared to last quarter.

The current EPS expectation of $3.39 is over 50% higher than the previous quarter's expectation of $2.07 per share.

The current revenue expectation of $16.11 billion is also almost 50% higher than the previous quarter's expectation of $11.09 billion. Just staggering numbers from the chip maker, and it seems as though they'll need to exceed these numbers yet again and post a strong guidance for next year if they want to keep this stock price sky high.

The stock price's expected move through this week based on current implied volatility is +-$37.64, which is just over 7% of the current stock price. This is a pretty large expected move for such a high-priced stock. This weekly expected move makes up over 50% of the expected move through the January 2024 monthly cycle, so there is a lot of market movement expected from this earnings announcement alone.

Bullish on NVDA stock for earnings

It's no surprise to see NVDA going straight to the moon after the surge of AI demand, and the expectation is that earnings will be very impressive this quarter. If that rings true, and they announce strong expectations for things to continue into next year, we could see little bearish resistance and the stock move higher.

Bearish on NVDA stock for earnings

Interestingly enough, it seems there is a lot of fear for downside movement this earnings quarter. At the end of the day, a massive increase in EPS and revenue expectations puts pressure on the company to deliver and paint a positive light. If they miss at all, or exhibit weak guidance for future quarters, we could easily see ""profit taking"" and long positions closed, which could put downside pressure on the stock.

There is still some turbulence in the sales relationship with China, which NVDA is closely tied to. This adds a layer of complexity to things, but negative political press is usually not good for single name equities regardless of who they are or what they produce. If there is shakiness on the earnings call, we could see the stock move lower.

Tune in to Options Trading Concepts Live at 11 a.m. CDT on Nov. 21 for a full options strategy breakdown for NVDA stock ahead of earnings after the close!

Mike Butler, tastylive director of market intelligence, has been in the markets and trading for a decade. He appears on Options Trading Concepts Live, airing Monday-Friday. @tradermikeyb

For live daily programming, market news and commentary, visit tastylive or the YouTube channels tastylive (for options traders), and tastyliveTrending for stocks, futures, forex & macro.

Trade with a better broker, open a tastytrade account today. tastylive, Inc. and tastytrade, Inc. are separate but affiliated companies.","(nvidia, product manufacturer, technology)
(nvidia, supplier-customer, tastytrade)
(nvidia, manufacturer, chip maker)
(nvidia, owner, nvidiastock)
(nvidia, owner, earnings call)
(nvidia, owner, eps)
(nvidia, owner, revenue expectations)
(nvidia, owner, implied volatility)
(nvidia, owner, weekly expected move)
(nvidia, owner, sales relationship with china)
(nvidia, owner, single name equities)
(nvidia, employees, mike butler)","{""SECTOR"": [""Technology""], ""COMPANY"": [""Nvidia"", ""tastytrade""], ""PEOPLE"": [""Mike Butler""], ""PRODUCTS"": [""NVDA stock"", ""chip maker"", ""options strategy"", ""stock price"", ""long positions"", ""earnings call"", ""EPS"", ""revenue expectations"", ""implied volatility"", ""weekly expected move"", ""January 2024 monthly cycle"", ""bearish resistance"", ""downside movement"", ""profit taking"", ""sales relationship with China"", ""single name equities"", ""turbulence""]}","{""title"": ""Nvidia (NVDA) Earnings Preview: Huge Revenue Expectations"", ""publisher"": ""tastylive"", ""authors"": NaN, ""published_date"": NaN}"
"In this piece, I evaluated two chipmaker stocks, NVIDIA (NASDAQ:NVDA) and Advanced Micro Devices (NASDAQ:AMD), using TipRanks’ comparison tool to determine which is better. A deeper analysis suggests a bullish view for NVIDIA and a bearish view for AMD.

NVIDIA develops graphics processing units (GPUs) semiconductors for artificial intelligence (AI), gaming, creative design, robotics, and autonomous vehicles. Meanwhile, AMD designs processors and related technologies for AI, data centers, gaming, and business-computing applications.

Shares of NVDA are up 240% year-to-date. Meanwhile, AMD stock has gained 93% year-to-date, including a 20% return over the last three months.

Despite NVIDIA’s much higher gains this year, it’s trading at a much lower valuation than AMD. We’ll look at their price-to-earnings (P/E) ratios to gauge their valuations against each other and that of their industry. For comparison, the U.S. semiconductor industry is currently trading at a P/E of 46.4 versus its three-year average P/E of 29.9.

NVIDIA (NASDAQ:NVDA)

At a P/E of around 64.3, NVIDIA is trading at a relatively small premium to its industry (compared to AMD’s premium anyway). In fact, the stock hasn’t been this cheap in a year, and its long-term gains also suggest a bullish view might be appropriate despite the tremendous year-to-date gain.

On a P/E basis, NVIDIA hasn’t been this cheap since December 2022. In fact, NVIDIA was trading at a P/E of over 100 just days ago — before the last earnings report. Of course, significantly higher earnings send a company’s P/E much lower if its stock price doesn’t change dramatically.

In NVIDIA’s case, its earnings exploded so much higher year-over-year that its P/E was cut nearly in half after just a small pullback from around $500 a share on November 22 to $489 on November 24. For its third quarter, the company reported adjusted earnings of $4.02 per share on $18.1 billion in revenue versus the consensus estimates of $3.37 per share on $16.2 billion in revenue.

Story continues

On a comparative basis, NVIDIA’s revenue jumped 206% year-over-year and 34% quarter-over-quarter, while its adjusted earnings rose nearly sevenfold year-over-year and 49% quarter-over-quarter. The chipmaker’s GAAP (generally accepted accounting principles) earnings rose more than 13 times from a year ago to $3.71 per share, also demonstrating exploding growth.

Before that earnings report, NVIDIA shares had soared to a record high of around $505 with a P/E of about 120 in November. Normally, I wouldn’t suggest a bullish view of a stock that has risen so much, so fast.

However, once the market recognizes its lower valuation — and recovers from management’s warning about significantly lower sales to China and other countries due to export restrictions — NVIDIA shares will likely continue their tear. Despite that warning, the chipmaker still guided for almost 231% revenue growth to $20 billion in the fourth quarter, so it clearly isn’t all that worried.

Even if the stock doesn’t recover dramatically in the near term, NVIDIA’s long-term stock-price gains of 267% over the last three years, 1,184% over the last five, and 13,066% over the last 10 provide some level of safety over the long term. In fact, I would use any near-term pullbacks to add to the position.

What is the Price Target for NVDA Stock?

NVIDIA has a Strong Buy consensus rating based on 30 Buys, three Holds, and zero Sell ratings assigned over the last three months. At $660.39, the average NVIDIA stock price target implies upside potential of 36.7%.

Advanced Micro Devices (NASDAQ:AMD)

At a P/E of 1,120, Advanced Micro Devices has the opposite problem of NVIDIA. Its valuation has skyrocketed because it’s now barely profitable. However, the chipmaker certainly isn’t going anywhere anytime soon, so it’s only a matter of time before it bounces back. For now, though, a bearish view seems appropriate, pending a better entry price or improved earnings numbers.

In the third quarter, AMD reported $299 million in GAAP net income, although that was an improvement from net income of $66 million a year ago. On an adjusted basis, the company’s net income rose 4% year-over-year to $1.1 billion. AMD also reported revenue of $5.8 billion for the quarter, up from $5.6 billion a year ago.

Unfortunately, AMD continues to play catch-up to NVIDIA in the area of artificial intelligence, although management did reveal some progress on its last earnings call, announcing improvements in the company’s AI software capabilities through R&D and acquisitions. Management also expects the MI300 data center chip, which will support AI models, to be “the fastest product to ramp to $1 billion in sales in AMD history.” In short, AMD will likely catch up to NVIDIA at some point, but we’re not there yet.

What is the Price Target for AMD Stock?

Advanced Micro Devices has a Strong Buy consensus rating based on 22 Buys, seven Holds, and zero Sell ratings assigned over the last three months. At $126.79, the average AMD stock price target implies upside potential of 2.9%.

Conclusion: Bullish on NVDA, Bearish on AMD

The battle between NVIDIA and Advanced Micro Devices has been going on for years, with one company pulling out in front of the other and then the other catching up and trading places. Nonetheless, neither of these companies is going anywhere anytime soon.

However, AMD could be playing catch-up to NVIDIA on AI for some time, calling for a wait-and-see approach. Meanwhile, NVIDIA will likely rerate higher once the market digests management’s warning about the new export restrictions.

Disclosure","(nvidia, product manufacturer, ai chips)
(nvidia, competitors, amd)
(nvidia, manufacturer, graphics processing units (gpus)
(nvidia, manufacturer, semiconductors)
(amd, designer/developer, processors)
(amd, designer/developer, ai)
(amd, designer/developer, data centers)
(amd, designer/developer, gaming)
(amd, designer/developer, business-computing applications)","{""SECTOR"": [""Technology""], ""COMPANY"": [""NVIDIA"", ""Advanced Micro Devices""], ""PEOPLE"": [], ""PRODUCTS"": [""graphics processing units (GPUs)"", ""semiconductors"", ""AI"", ""gaming"", ""creative design"", ""robotics"", ""autonomous vehicles"", ""processors"", ""data centers"", ""business-computing applications"", ""U.S. semiconductor industry""]}","{""title"": ""NVDA vs. AMD: Which Chip Stock is the Better Buy?"", ""publisher"": ""Yahoo Finance"", ""authors"": NaN, ""published_date"": NaN}"
