InputText,Relationships,SectorData,MetaData
"Nvidia (NVDA) Reports Earnings Tomorrow. What To Expect

Leading designer of graphics chips Nvidia (NASDAQ:NVDA) will be reporting results tomorrow afternoon. Here's what to expect.

Last quarter Nvidia reported revenues of $13.51 billion, up 101% year on year, beating analyst revenue expectations by 21.9%. It was an incredible quarter for the company, with beats across nearly every key metric. We were particularly impressed by its revenue beat, driven by strong performance in the data center segment which houses the company's AI chips division. Furthermore, we were encouraged by Nvidia's revenue guidance for next quarter, which blew past analysts' expectations.

Is Nvidia buy or sell heading into the earnings? Read our full analysis here, it's free.

This quarter analysts are expecting Nvidia's revenue to grow 172% year on year to $16.11 billion, improving on the 16.5% year-over-year decline in revenue the company had recorded in the same quarter last year. Adjusted earnings are expected to come in at $3.39 per share.

Nvidia Total Revenue

The analysts covering the company have been growing increasingly bullish about the business heading into the earnings, with revenue estimates seeing six upwards revisions over the last thirty days. The company has a history of exceeding Wall St's expectations, beating revenue estimates every single time over the past two years on average by 5.5%.

Looking at Nvidia's peers in the processors and graphics chips segment, some of them have already reported Q3 earnings results, giving us a hint of what we can expect. Lattice Semiconductor delivered top-line growth of 11.4% year on year, beating analyst estimates by 0.2% and Allegro MicroSystems reported revenues up 15.9% year on year, exceeding estimates by 0.2%. Lattice Semiconductor traded down 12.3% on the results, and Allegro MicroSystems was down 4.0%.

Read our full analysis of Lattice Semiconductor's results here and Allegro MicroSystems's results here.

There has been positive sentiment among investors in the processors and graphics chips segment, with the stocks up on average 11.4% over the last month. Nvidia is up 14.9% during the same time, and is heading into the earnings with analyst price target of $641.9, compared to share price of $493.6.

Story continues

One way to find opportunities in the market is to watch for generational shifts in the economy. Almost every company is slowly finding itself becoming a technology company and facing cybersecurity risks and as a result, the demand for cloud-native cybersecurity is skyrocketing. This company is leading a massive technological shift in the industry and with revenue growth of 70% year on year and best-in-class SaaS metrics it should definitely be on your radar.

Join Paid Stock Investor Research

Help us make StockStory more helpful to investors like yourself. Join our paid user research session and receive a $50 Amazon gift card for your opinions. Sign up here.

The author has no position in any of the stocks mentioned.","(technology, product manufacturer, nvidia)
(technology, product manufacturer, lattice semiconductor)
(technology, product manufacturer, allegro microsystems)
(nvidia, supplier-customer, lattice semiconductor)
(nvidia, designer/developer, graphics chips)
(nvidia, manufacturer, ai chips)","{""SECTOR"": [""Technology""], ""COMPANY"": [""Nvidia"", ""NASDAQ"", ""Lattice Semiconductor"", ""Allegro MicroSystems""], ""PEOPLE"": [], ""PRODUCTS"": [""graphics chips"", ""AI chips"", ""processors"", ""cloud-native cybersecurity""]}","{""title"": ""Nvidia (NVDA) Reports Earnings Tomorrow. What To Expect"", ""publisher"": ""Yahoo Finance"", ""authors"": ""Adam Hejl"", ""published_date"": NaN}"
"Semiconductor giant NVIDIA Corporation (NVDA) enjoys a central position in the current Artificial Intelligence (AI) boom by virtue of its Graphics Processing Units (GPUs). Underscoring its market position, NVDA’s revenue of $13.51 billion for the fiscal second quarter topped the $11.22 billion analysts’ estimate, while its adjusted EPS of $2.70 beat the $2.09 estimate.

However, last month, the United States expanded its restriction on exporting sophisticated NVDA AI chips beyond China to other regions, including some Middle Eastern countries. On the other hand, the company stated that it does not have an “immediate material impact.”

Meanwhile, the semiconductor industry is undergoing a slump. The worldwide sales of semiconductors came in at $124.50 billion for the second quarter of 2023, registering a 17.3% decrease from the second quarter of 2022.

Given this backdrop, let’s look at the trends of NVDA’s key financial metrics to understand why it could be wise to wait for a better entry point in the stock.

Examining NVIDIA Corporation’s Financial Performance: An In-Depth Analysis of Multiple Metrics from 2020 to 2023

Based on the given data, there have been significant fluctuations and trends in NVDA’s Price/Sales ratio (P/S). Below is a summary of the P/S movements:

From October 2020 to January 2021, NVDA’s P/S declined from 22.50 to 20.40, demonstrating a downward trend.

Between January and May of 2021, the P/S saw a mild reduction, decreasing slightly from 20.40 to 20.32.

However, between May and August 2021, the P/S increased remarkably from 20.32 to 23.73, indicating an upward movement.

Between August and October 2021, there was a significant increase in the P/S, jumping to 32.89 in October 2021.

Post the high of October 2021, a notable decline in the P/S was observed. As of January 2022, the P/S fell drastically to 24.67, followed by a further decrease to 15.92 in May 2022.

Subsequently, it declined further to 12.64 by July 2022, then slightly increased to 13.27 in October 2022, showing a tendency for stagnation with a slight upward trend.

By January 2023, the P/S made a strong comeback and stood at 21.32, showing a significant increase for that period.

The upward trend continued until April 2023, when the P/S peaked at 37.17, subsequently dropping slightly to 35.40 in July 2023.

Overall, comparing the first value in October 2020 (22.50) with the latest recorded value in July 2023 (35.40), NVDA’s Price/Sales ratio has seen a growth rate of approximately 57.33%.

However, it’s important to note the high levels of volatility within the period. It would be beneficial to closely watch the company’s financials and market conditions to predict future P/S movements.

The gross margin of NVDA displayed a mixed trend, with overall increasing values until mid-2022, followed by a downturn and then an upward correction. Here are some notable points in more detail:

On October 25, 2020, the gross margin was 62.60%.

A slight decrease was seen by January 31, 2021, where the margin was 62.30%.

The gross margin hovered over 62%-63% until May 2, 2021.

Thereafter, the margin climbed, reaching 64.90% on January 30, 2022.

It peaked at 65.30% on May 1, 2022.

A sharp decline was noted toward July 31, 2022, falling to 60.40%.

This downward trend continued, hitting a low of 56.30% on April 30, 2023.

An abrupt rebound was seen in July 2023, where the gross margin grew to 64.60%.

Measuring from the first value in October 2020 to the last given data point in July 2023, there is a growth rate of 3.19%. Please note that there is a marked fluctuation in the latter part of the series, which saw a fall and a notable recovery in the gross margin, illustrating the volatile performance of NVDA in recent years.

The ROIC of NVDA has experienced both upward and downward fluctuations over the period from October 2020 to July 2023. Key highlights include:

Starting from October 25, 2020, the ROIC was 0.27.

There was a dip in January 2021 with a ROIC of 0.233.

The value rebounded in May 2021 to 0.245 and further increased to its peak at 0.281 by January 30, 2022.

However, the subsequent period saw a distinct decreasing trend, reaching as low as 0.152 in October 2022.

This downtrend reversed dramatically in the second half of 2023, with the ROIC surging to 0.303 as of July 30, 2023.

Considering the last data point of 0.303 in July 2023 and the first data point of 0.27 in October 2020, there has been a growth rate calculated as approximately 11%. While recent data suggests some volatility, the current trend indicates a sharp recovery from previous lows in the ROIC of NVDA.

The series of data represents the current ratio of NVDA from October 2020 till July 2023. Here is a summary of the trend and fluctuations:

In October 2020, the current ratio was at 3.92.

There was a noticeable increase during 2021, reaching a peak at 7.14 in October 2021.

By January 2022, it declined slightly to 6.65 but still remained relatively high compared to the start of the trend.

A significant drop was observed in the first half of 2022, with the current ratio plunging to 3.62 in July 2022. It further fell to 3.39 by October 2022.

The current ratio modestly recovered to 3.52 in January 2023, only to experience a slight dip in April 2023 at 3.43.

By July 2023, the current ratio stood at 2.79, marking the lowest point in the entire series.

Overall, despite a promising growing trend in 2021, NVDA’s current ratio has experienced a substantial decline from the start of 2022 and into 2023. Measuring the growth rate from the first value to the last, corresponding to October 2020’s value of 3.92 to July 2023’s value of 2.79, illustrates a decrease of approximately -28.83%.

This indicates that the company’s short-term liquidity has deteriorated over the evaluated period. It’ll be critical to observe whether this downward trend continues or reverses in subsequent quarters.

Analyzing the Rising Trend of NVIDIA Corporation’s Share Price in 2023

The data for NVDA shows a general increasing trend in the share price from March 2023 to September 2023. Here’s a breakdown of the trends:

Starting from $265.10 on March 24, 2023, the share price slightly increased to $269.28 by the end of March 2023.

The month of April 2023 saw minute fluctuations, with the price finally settling at $270.12 by April 28, showing a general decelerating growth rate.

However, May 2023 witnessed a clear acceleration in the growth rate, starting at $281.73 on May 5 and reaching a high of $342.22 by the end of the month.

This rapid growth rate continued into June 2023, with the price soaring to $395.27 on June 2 and gradually climbing to a peak of $428.75 on June 23. This represents significant accelerated growth.

In July 2023, despite a momentary dip to $413.50 at its start, the price resumed an upward trajectory, eventually reaching $461.01 by July 21

In August 2023, there was a temporary deceleration, with the price dropping to $433.02 on August 11, but it recovered swiftly, concluding the month at $468.04 on August 25.

September 2023 saw the highest price at $483.83 on September 1. However, there was a notable deceleration in the growth rate, with the price falling to $454.85 by September 13.

In summary, throughout the observed period, NVDA’s stock price generally increased, exhibiting stages of accelerated growth, particularly in May and June 2023. Despite periodic fluctuations and decelerations, the overall trend indicates positive growth. Here is a chart of NVDA’s price over the past 180 days.

Analyzing NVIDIA Corporation’s High Sentiment, Quality, and Momentum Ratings in 2023

The POWR Ratings grade of NVDA, a stock in the Semiconductor & Wireless Chip category, has been persistently listed as C (Neutral) over the examined period from March 18, 2023, to September 14, 2023. Throughout this duration, we can notice a gradual improvement in its rank among the 92 stocks in its category. A summary of the ranking trend includes:

On March 18 and 25, 2023, it ranked #67.

From April 1, 2023, to May 6, 2023, the rank progressively improved from #63 to #62.

After a slight improvement to rank #59 on May 13, the rank soared to #43 by June 3.

Over the next month until July 15, the rank fluctuated slightly between #43 and #45.

After lingering at rank #45 for a few weeks, there was another drastic improvement to #27 by September 2, maintaining this position up till the last recorded date, September 14, 2023.

The POWR Ratings for NVDA showed particularly noteworthy dimensions in terms of Sentiment, Quality, and Momentum. When reviewing the data from March 2023 to September 2023, these three dimensions consistently had high ratings. Let’s discuss these three dimensions in more detail:

Sentiment: The Sentiment rating remained consistently high throughout the period, starting from 94 in March 2023 and reaching its peak at 99 in September 2023. This persistent high rating demonstrates an overall positive perception of NVDA during this time.

Quality: This dimension also stayed strong in its ratings. It started at a solid 84 in March 2023, gradually increased, and eventually reached an impressive rating of 95 by September 2023. The consistent upward trend signifies that the quality associated with NVDA has been improving over this period.

Momentum: Momentum started at 72 in March 2023 and saw some fluctuations over the months. Notably, it peaked at 95 in June 2023, dropped slightly to 90 in July 2023, and then rose again, landing at 82 in September 2023. Despite some fluctuation, the Momentum ratings remained relatively high, indicating a strength of momentum in NVDA’s activities.

It is crucial to note that while Sentiment, Quality, and Momentum have demonstrated high ratings and noted trends, they are not the only considerations when making investment decisions and evaluating a company’s overall performance. Other factors and dimensions could be equally, if not more, significant depending on specific circumstances and indicators.

How does NVIDIA Corporation (NVDA) Stack Up Against its Peers?

Other stocks in the Semiconductor & Wireless Chip sector that may be worth considering are Renesas Electronics Corporation (RNECF), Everspin Technologies, Inc. (MRAM), and STMicroelectronics N.V. (STM) – they have better POWR Ratings. Click here to explore other stocks in the Semiconductor & Wireless Chip sector.

What To Do Next?

Discover 10 widely held stocks that our proprietary model shows have tremendous downside potential. Please make sure none of these “death trap” stocks are lurking in your portfolio:

10 Stocks to SELL NOW! >

NVDA shares were trading at $452.61 per share on Thursday afternoon, down $2.24 (-0.49%). Year-to-date, NVDA has gained 209.82%, versus a 18.63% rise in the benchmark S&P 500 index during the same period.

About the Author: Anushka Dutta

Anushka is an analyst whose interest in understanding the impact of broader economic changes on financial markets motivated her to pursue a career in investment research. More...

More Resources for the Stocks in this Article","(semiconductor, product manufacturer, nvidia)
(technology, product manufacturer, nvidia)
(nvidia, supplier-customer, china)
(nvidia, supplier-customer, middle eastern countries)","{""SECTOR"": [""Semiconductor"", ""Technology""], ""COMPANY"": [""NVIDIA Corporation (NVDA)"", ""Renesas Electronics Corporation (RNECF)"", ""Everspin Technologies"", ""Inc. (MRAM)"", ""STMicroelectronics N.V. (STM)""], ""PEOPLE"": [], ""PRODUCTS"": []}","{""title"": ""NVDA: Analyzing the Potential of NVIDIA (NVDA) as a Stock Buy"", ""publisher"": ""StockNews.com"", ""authors"": NaN, ""published_date"": NaN}"
"What can be said about Nvidia (NVDA) that has not already been said? With year-to-date stock gains of close to 240%, crushing the 17% rise in the S&P 500 index, the market has run out of superlatives.

Expanding that horizon by one year and three years, the graphics chip giant has skyrocketed 210% and 265%, respectively. For investors who are thinking of taking profits, doing so could prove premature. Despite the strong stock performance, the shares still somehow appear cheap, because as the stock has risen, the company continue to raise its profit forecast. There’s a chance it can do so again when it reports third quarter fiscal 2024 earnings results after Wednesday's closing bell.

The graphics chip powerhouse has proven that the euphoria surrounding artificial intelligence (AI) and generative AI is more than hype. Unveiled in 2022, Nvidia’s generative AI accelerators have already seized market share from competitors who are only in the development stage. Nvidia’s expected growth for its GPU datacenter accelerators has spiked amid generative AI models such as ChatGPT in which Microsoft (MSFT) has made a significant investment via its partnership with OpenAI.

In a note to clients after its Q2 results, Wedbush Securities analyst Dan Ives said the results are a ""historical moment for the broader tech sector,"" likening Nvidia’s guidance and commentary to that of a ""drop the mic"" moment. There is likely to be continued datacenter revenue acceleration for many quarters to come, underscoring the opportunity within AI is still at a nascent stage. But to continue to the stock's upward trend, the company on Wednesday must continue to tout its growth prospects for the next quarter and beyond.

For the three months that ended September, Wall Street expects the Santa Clara, Calif.-based company to earn $3.10 per share on revenue of $14.89 billion. This compares to the year-ago quarter when earnings came to 58 cents per share on revenue of $5.93 billion. For the full year, ending in December, earnings of $10.02 per share would rise 200% year over year, while full-year revenue of $50.68 billion would rise 88% year over year.

The expected revenue and earnings growth for the quarter and full year has tech investors gushing over Nvidia. Nvidia’s second quarter numbers and Q3 guidance suggests there is a sort of relentless demand for AI, especially in the datacenter, where the company’s revenue surged three-fold on a year-over-year basis. In the second quarter, Nvidia reported adjusted EPS of $2.70, which breezed past analysts's expectations by a whopping 30%.

For some context, Nvidia not only blew away its own guidance of $2.07, the consensus estimate for this quarter a year ago was a modest $1.07 per share. Q2 revenue also crushed Street estimates by a staggering 22%, coming in at $13.51 billion while the Street was looking for $11.1 billion. Aside from growing demand for generative AI, the revenue growth was driven by large language models utilizing Nvidia’s GPUs.

""The October quarter guidance of $16 billion was well above $12.6 billion estimates and quickly rising whisper numbers on the Street and will be fuel in the engine to ignite a tech rally we see continuing into the rest of the year,” Ives wrote. As a result, analysts are projecting NVDA stock to go even higher. The stock has a consensus price target of $580; from current levels of $493, that assumes additional premiums of close to 20%.

With the growing adoption of cloud-based solutions and growing demand for generative AI, Nvidia continues to enjoy tailwinds. Combined with rising margins and quarterly free cash flow, it would be a mistake to part with the stock ahead of Wednesday’s results.

The views and opinions expressed herein are the views and opinions of the author and do not necessarily reflect those of Nasdaq, Inc.",,"{""SECTOR"": [""Technology"", """"]}","{""title"": ""Nvidia (NVDA) Q3 2024 Earnings: What to Expect"", ""publisher"": ""Nasdaq"", ""authors"": NaN, ""published_date"": NaN}"
"Artisan Partners, an investment management company, released its “Artisan Developing World Fund” third quarter 2023 investor letter. A copy of the same can be downloaded here. In the third quarter, the fund (Investor Class) returned -7.31% compared to -2.93% for the MSCI Emerging Markets Index. The fund has returned 74.89% cumulatively since June 30, 2015, compared to a 19.73% return for the benchmark. In addition, please check the fund’s top five holdings to know its best picks in 2023.

Artisan Developing World Fund highlighted stocks like NVIDIA Corporation (NASDAQ:NVDA) in the third quarter 2023 investor letter. Headquartered in Santa Clara, California, NVIDIA Corporation (NASDAQ:NVDA) provides computer graphics processors, chipsets, and related multimedia software. On October 11, 2023, NVIDIA Corporation (NASDAQ:NVDA) stock closed at $468.06 per share. One-month return of NVIDIA Corporation (NASDAQ:NVDA) was 2.69%, and its shares gained 291.35% of their value over the last 52 weeks. NVIDIA Corporation (NASDAQ:NVDA) has a market capitalization of $1.156 trillion.

Artisan Developing World Fund made the following comment about NVIDIA Corporation (NASDAQ:NVDA) in its Q3 2023 investor letter:

""Our focus on scalable business models has its roots in our economic framework. As potential output moderated in most emerging countries, it became clear to us affordability was not improving and that low penetration was necessary but not sufficient for value creation. We eliminated companies from the portfolio that were struggling to generate revenue significantly in excess of fixed costs, often replacing them with passport companies such as NVIDIA Corporation (NASDAQ:NVDA) and Airbnb that were economically tied to emerging markets. Over a period of time, we have been successful in redefining the emerging markets opportunity set around real per capita GDP increases, growth in the middle class, revenue velocity and demand fulfilment. Combined with changes in the market backdrop that have resulted in privileged competitive positions for companies with financial strength and access to capital, we find our opportunity set expanding anew to include companies that are both based in emerging markets and conducive to value creation.""

Story continues

Nvidia, Software

Photo by Christian Wiediger on Unsplash

NVIDIA Corporation (NASDAQ:NVDA) is in 17th position on our list of 30 Most Popular Stocks Among Hedge Funds. As per our database, 175 hedge fund portfolios held NVIDIA Corporation (NASDAQ:NVDA) at the end of second quarter which was 132 in the previous quarter.

We discussed NVIDIA Corporation (NASDAQ:NVDA) in another article and shared the list of best aggressive growth stocks to buy according to hedge funds. In addition, please check out our hedge fund investor letters Q3 2023 page for more investor letters from hedge funds and other leading investors.

Suggested Articles:

Disclosure: None. This article is originally published at Insider Monkey.",,"{""SECTOR"": [""Technology""], ""PEOPLE"": [], ""PRODUCTS"": [""Artisan Developing World Fund"", ""computer graphics processors"", ""chipsets"", ""related multimedia software"", ""stock"", ""shares"", ""market capitalization""]}","{""title"": ""Should You Invest in NVIDIA Corporation (NVDA)?"", ""publisher"": ""Yahoo Finance"", ""authors"": ""Soumya Eswaran"", ""published_date"": NaN}"
