InputText,Relationships,SectorData,MetaData
"After reaching an important support level, Nvidia (NVDA) could be a good stock pick from a technical perspective. NVDA surpassed resistance at the 20-day moving average, suggesting a short-term bullish trend.

The 20-day simple moving average is a popular investing tool. Traders like this SMA because it offers a look back at a stock's price over a shorter period and helps smooth out price fluctuations. The 20-day can also show more trend reversal signals than longer-term moving averages.

Like other SMAs, if a stock's price is moving above the 20-day, the trend is considered positive. When the price falls below the moving average, it can signal a downward trend.

Over the past four weeks, NVDA has gained 13.7%. The company is currently ranked a Zacks Rank #1 (Strong Buy), another strong indication the stock could move even higher.

The bullish case solidifies once investors consider NVDA's positive earnings estimate revisions. No estimate has gone lower in the past two months for the current fiscal year, compared to 8 higher, while the consensus estimate has increased too.

With a winning combination of earnings estimate revisions and hitting a key technical level, investors should keep their eye on NVDA for more gains in the near future.

Want the latest recommendations from Zacks Investment Research? Today, you can download 7 Best Stocks for the Next 30 Days. Click to get this free report

NVIDIA Corporation (NVDA) : Free Stock Analysis Report

To read this article on Zacks.com click here.

Zacks Investment Research","(nvidia, market leader, technology)
(nvidia, manufacturer, nvidia)","{""SECTOR"": [""Technology""], ""COMPANY"": [""Nvidia"", ""Zacks Investment Research""], ""PEOPLE"": [], ""PRODUCTS"": [""20-day moving average"", ""SMAs"", ""NVDA (stock ticker)""]}","{""title"": ""Nvidia (NVDA) Just Flashed Golden Cross Signal: Do You Buy?"", ""publisher"": ""Yahoo Finance"", ""authors"": ""Zacks Equity Research"", ""published_date"": NaN}"
"Kickstarting your investment journey can be both exciting and scary at the same time, and if you're new to investing, you may not know where to even begin. However, one thing is for certain -- stocks set to beat the market over the next 12 months serve as the perfect foundation for any kind of investor.

Now, let's break down why adding this one exceptional stock, highlighted below, to your portfolio could be a recipe for success.

Why You Should Pay Attention to Nvidia (NVDA)

NVIDIA Corporation is the worldwide leader in visual computing technologies and the inventor of the graphic processing unit, or GPU. Over the years, the company’s focus has evolved from PC graphics to artificial intelligence (AI) based solutions that now support high performance computing (HPC), gaming and virtual reality (VR) platforms.

On May 20, 2019, NVDA was added to the Zacks Focus List at $39.13 per share. Shares have increased 1042.04% to $446.88 since then.

15 analysts revised their earnings estimate higher in the last 60 days for fiscal 2024, while the Zacks Consensus Estimate has increased $2.95 to $10.74. NVDA also boasts an average earnings surprise of 9.8%.

Additionally, Nvidia's earnings are expected to grow 221.6% for the current fiscal year.

It can be very profitable to buy stocks with rising earnings estimates, as stock prices respond to revisions. By adding a Focus List stock like NVDA, there's a great chance you'll be getting into a company whose future earnings estimates will be raised, which can lead to price momentum.

Want the latest recommendations from Zacks Investment Research? Today, you can download 7 Best Stocks for the Next 30 Days. Click to get this free report

NVIDIA Corporation (NVDA) : Free Stock Analysis Report

To read this article on Zacks.com click here.

Zacks Investment Research","(nvidia, product manufacturer, technology)
(zacks investment research, investor, nvidia)
(nvidia, manufacturer, gpu)","{""SECTOR"": [""Technology""], ""COMPANY"": [""Nvidia"", ""Zacks Investment Research""], ""PEOPLE"": [], ""PRODUCTS"": [""GPU"", ""HPC"", ""gaming platforms"", ""VR platforms"", ""Focus List""]}","{""title"": ""Why Nvidia (NVDA) is a Top Stock for the Long-Term"", ""publisher"": ""Yahoo Finance"", ""authors"": ""Zacks Equity Research"", ""published_date"": NaN}"
"Investors seek growth stocks to capitalize on above-average growth in financials that help these securities grab the market's attention and produce exceptional returns. However, it isn't easy to find a great growth stock.

In addition to volatility, these stocks carry above-average risk by their very nature. Also, one could end up losing from a stock whose growth story is actually over or nearing its end.

However, the Zacks Growth Style Score (part of the Zacks Style Scores system), which looks beyond the traditional growth attributes to analyze a company's real growth prospects, makes it pretty easy to find cutting-edge growth stocks.

Nvidia (NVDA) is on the list of such stocks currently recommended by our proprietary system. In addition to a favorable Growth Score, it carries a top Zacks Rank.

Research shows that stocks carrying the best growth features consistently beat the market. And for stocks that have a combination of a Growth Score of A or B and a Zacks Rank #1 (Strong Buy) or 2 (Buy), returns are even better.

While there are numerous reasons why the stock of this maker of graphics chips for gaming and artificial intelligence is a great growth pick right now, we have highlighted three of the most important factors below:

Earnings Growth

Arguably nothing is more important than earnings growth, as surging profit levels is what most investors are after. For growth investors, double-digit earnings growth is highly preferable, as it is often perceived as an indication of strong prospects (and stock price gains) for the company under consideration.

While the historical EPS growth rate for Nvidia is 31.2%, investors should actually focus on the projected growth. The company's EPS is expected to grow 224.9% this year, crushing the industry average, which calls for EPS growth of -12.8%.

Impressive Asset Utilization Ratio

Asset utilization ratio -- also known as sales-to-total-assets (S/TA) ratio -- is often overlooked by investors, but it is an important indicator in growth investing. This metric exhibits how efficiently a firm is utilizing its assets to generate sales.

Story continues

Right now, Nvidia has an S/TA ratio of 0.74, which means that the company gets $0.74 in sales for each dollar in assets. Comparing this to the industry average of 0.66, it can be said that the company is more efficient.

In addition to efficiency in generating sales, sales growth plays an important role. And Nvidia is well positioned from a sales growth perspective too. The company's sales are expected to grow 102.2% this year versus the industry average of -6.6%.

Promising Earnings Estimate Revisions

Beyond the metrics outlined above, investors should consider the trend in earnings estimate revisions. A positive trend is a plus here. Empirical research shows that there is a strong correlation between trends in earnings estimate revisions and near-term stock price movements.

There have been upward revisions in current-year earnings estimates for Nvidia. The Zacks Consensus Estimate for the current year has surged 1.2% over the past month.

Bottom Line

While the overall earnings estimate revisions have made Nvidia a Zacks Rank #1 stock, it has earned itself a Growth Score of A based on a number of factors, including the ones discussed above.

You can see the complete list of today's Zacks #1 Rank (Strong Buy) stocks here.

This combination indicates that Nvidia is a potential outperformer and a solid choice for growth investors.

Want the latest recommendations from Zacks Investment Research? Today, you can download 7 Best Stocks for the Next 30 Days. Click to get this free report

NVIDIA Corporation (NVDA) : Free Stock Analysis Report

To read this article on Zacks.com click here.

Zacks Investment Research","(nvidia, product manufacturer, technology)","{""SECTOR"": [""Technology""], ""COMPANY"": [""Nvidia"", """"]}","{""title"": ""Here is Why Growth Investors Should Buy Nvidia (NVDA) Now"", ""publisher"": ""Yahoo Finance"", ""authors"": ""Zacks Equity Research"", ""published_date"": NaN}"
"This week is Thanksgiving week in the U.S., a week that is typically slow for the market. Many traders do what I will be doing; they take an extended break around the holiday to spend time with their families. That doesn’t mean, though, that the days around the Thursday holiday are completely without any interest, and perhaps the biggest event this week will come after the market close when Nvidia (NVDA) reports their calendar Q3 earnings.

One company’s earnings are not usually of much import beyond their own shareholders, but Nvidia is different. It is a maker of graphics processors and mobile technologies with such a hold on the market for advanced hardware that they have become the embodiment of the market’s excitement about AI. So far, they have borne that responsibility well, not just beating estimates for earnings each quarter, but smashing them, while raising their guidance consistently along the way.

That has, almost inevitably, led to skepticism in some quarters. When a company grows as rapidly as Nvidia has and just seems to get everything right, people understandably start to question how sustainable that is. If nothing else, the law of large numbers as it applies to stock analysis makes continued growth unlikely. It is far easier to grow $100 million of sales by 100% than it is to do the same from a starting point of $1 billion. Also, at some point, the reasoning goes, growth in demand for AI related products has to plateau. Or, even if it continues to grow, a strong competitor to Nvidia will emerge.

Neither of those things have happened yet, though, and Nvidia just keeps going from strength to strength. That has been reflected in the stock over the last year:

NVDA has gained around 300% in 52 weeks, which looks a bit frothy until you dig into the numbers. A chart like that inevitably has some people shouting about how it is all hype and that NVDA is a great big bubble, or whatever. When you look at the details, though, that gain looks fully justified. One can even make a strong argument that, actually, it is underdone, and that NVDA still represents value at these levels. If this were pure speculation, we would be waiting for reality to catch up with the price, but in this case, it is the other way around.

The consensus of analysts’ estimates for Nvidia’s EPS this last quarter is $3.37, which is a 481% gain over the $0.58 per share of profit reported in the same quarter last year. That 300% pop doesn’t look quite so outlandish now, right? In fact, as I said, that implies that NVDA’s market price has failed to keep pace with the increases in earnings, let alone factor in massively improved growth rates that have proven sustainable for the full year, and that it is has at least 50% upside from here, just to keep up with the company’s performance.

When Nvidia reports this afternoon, I have no doubt that the naysayers will make themselves heard, no matter what the numbers say. Based on recent history, they will probably beat expectations and raise guidance again, but that will only embolden the bears further. They will cry that any pop in the stock that follows that is just more hype, even though it would be a perfectly logical reaction to another great quarter. What I am looking for, though, as someone who owns NVDA and is looking to add more, is a relatively unimpressive EPS number, or a note of caution about the future in the earnings commentary, or the analysts’ call that will follow the release at 5 PM today.

They could beat expectations, but not by the spectacular amounts that have become the norm recently. They could also point out what everyone already knows, that the economic future is uncertain, and the stock will still get hit hard as the notion that it is way overbought is pushed. Should that happen, big institutional investors, who typically rely more on facts and data than bluster and bombast, will step in and buy.

On the other hand, if NVDA delivers another blowout quarter and shares optimism about what is to come, even in the face of uncertainty, then institutional investors likely won't step in and buy in that scenario. But either way, NVDA will be a buy tomorrow morning. I believe there is a chance that the first scenario plays out, so will wait until after earnings to make a move, but at some point before the holiday, I will be buying.

The views and opinions expressed herein are the views and opinions of the author and do not necessarily reflect those of Nasdaq, Inc.","(nvidia, product manufacturer, ai chips)
(nvidia, manufacturer, graphics processors)
(nvidia, manufacturer, mobile technologies)
(nvidia, manufacturer, ai related products)","{""SECTOR"": [""Technology""], ""COMPANY"": [""Nvidia (NVDA)""], ""PEOPLE"": [], ""PRODUCTS"": [""graphics processors"", ""mobile technologies"", ""AI related products""]}","{""title"": ""Why I Will Buy Nvidia (NVDA) After Earnings Whatever the Report Says"", ""publisher"": ""Nasdaq"", ""authors"": NaN, ""published_date"": NaN}"
"In the past year, the NVIDIA Corporation (NVDA) has received significant attention from investors, spurred on by the burgeoning AI market. The tech titan’s Graphics Processing Units (GPUs) have been met with great demand amongst AI developers, positioning NVIDIA as a potent force within the AI industry.

Notably, while the company demonstrates remarkable potential in AI, it is also reaping substantial profits in the sector. Yet despite impressive revenue growth in the last reported quarter, and fuelled by an upswing in AI GPU sales, NVIDIA continues to navigate complex macroeconomic challenges. Persistent export restrictions have been detrimental to sales with organizations in countries such as China.

With the current setting of regulations, NVIDIA anticipates a notable decline in sales in regions burdened by these export control measures in the current quarter. As the US tightens its grip on export controls, NVIDIA is diligently striving to develop China-specific chips, however, it must be noted the U.S. is poised to tighten those controls further in an attempt to prevent spikes in new technologies that would favor Beijing.

The delay in launching the Chinese-focused AI chips has led the NVDA stock to shrink by 2.6% over the past month. Although this recent dip may appear as an enticing investment opportunity, it is important to bear in mind that the stock could experience short-term upheaval. Looking at the broader perspective, it may be advisable to explore other potential chip stocks. Exploring key financial metrics can provide further insight into the current situation.

Analyzing NVIDIA Corporation’s Financial Performance and Prospects from 2021 to 2023

The trailing-12-month Net Income of NVDA in the given period shows an overall upward trend with some fluctuations.

Starting from January 2021, the Net Income was $4.33 billion.

A consistent growth was seen over the following months, reaching a peak at $9.75 billion in January 2022.

However, a significant downward fluctuation occurred after this point. By October 2022, the Net Income had fallen to $5.95 billion, marking a decrease of approximately 39% from its peak.

This downward trend continued into the early part of 2023 when it bottomed out at $4.37 billion in January 2023.

However, a reversal was observed by April 2023, when the Net Income began to increase again, reaching $4.79 billion.

There was a substantial leap in the NVDA’s Net Income in July 2023, where it hit $10.33 billion.

The most recent data from October 2023 indicates a surge in the Net Income of NVDA to a record high of $18.88 billion. In terms of growth rate calculated from the start to the end of the series, there is a considerable increase from $4.33 billion in January 2021 to $18.88 billion in October 2023. The growth rate in this case is approximately 336%. From the above, its important to note the emphasis on the volatility in performance, as reflected in the oscillating trend, alongside the impressive overall growth rate. Despite periods of downswing, the last value in the series suggests a strong upturn for the reported period.

The trailing-12-month revenue trend for NVDA has generally been on the rise over the span of the recorded data series. Here’s the summary:

Started at $16.68 billion in January 2021.

Showed steady growth through 2021 and into the first half of 2022, peaking at $29.74 billion by July 2022.

Experienced a short dip to $28.56 billion by October 30, 2022

There was another decrease bringing the Revenue down to $25.88 billion by April 2023.

In July 2023, there was a strong resurgence up to $32.68 billion

A significant jump was observed by October 2023, where the Revenue hit a high of $44.87 billion.

Though the data series showed some fluctuations, the overall trend direction is upwards. Measuring from the start value in January 2021 to the last value in October 2023, NVDA experienced significant growth in its Revenue. The growth rate within this period is approximately 169%.

The reported Gross Margin of NVDA has experienced a series of fluctuations over the last three years.

On January 31, 2021, the Gross Margin was at 62.3%.

By May 2, 2021, there was a minor increase to 62.4%.

A more notable increase occurred by August 1, 2021, as the Gross Margin rose to 63.8%.

The upward trend continued through October 31, 2021, with the Gross Margin reaching 64.4%, and by January 30, 2022, hitting a peak of 64.9%.

However, as of May 1, 2022, the Gross Margin started declining, falling to a low of 57.8% by October 30, 2022.

By January 29, 2023, the Gross Margin kept decreasing to 56.9% and further fell to its lowest point of 56.3% on April 30, 2023.

However, from July 30, 2023, there was a noticeable surge in the Gross Margin, with it rising sharply to 64.6%.

This spike increased further, as by October 29, 2023, the Gross Margin had soared to its highest documented value of 69.9%.

The calculated growth rate from the initial 62.3% in January 2021 to the final recorded value of 69.9% in October 2023 reveals an overall positive trend despite the alternating upswing and downswing. Overall, NVDA’s Gross Margin shows resilience with a substantial recovery in the latter part of the data series, signifying a potentially brighter future moving forward.

The Current Ratio of NVDA has shown significant fluctuations over the analyzed period from January 2021 to October 2023.

On January 31, 2021, the Current Ratio was 4.09.

It then peaked at 7.145 on October 31, 2021.

Post this peak, there was a downward trend until the Current Ratio reached its lowest point, 2.787, in July 2023.

The most recent value recorded, in October 2023, showed a rebound to 3.588.

Although October 2023’s Current Ratio is lower than the initial value in January 2021, this marks a significant recovery from the previous quarter.

Growth: On comparing the first recorded value in January 2021 (4.09) to the most recent one in October 2023 (3.588), there is an overall decrease of about 12.22%.

Recent Trend: From 2022 onwards, the Current Ratio of NVDA faced a downtrend, reaching its lowest level in July 2023 (2.787). However, the latest data from October 2023 indicates a potential resurgence, with the figure climbing back up to 3.588. The fluctuation in NVDA’s Current Ratio throughout these years reflects the variances in the company’s short-term liquidity and ability to cover its obligations.

Analyzing NVIDIA Corporation’s Semi-Annual Stock Price Fluctuations and Trends

Based on the given data, it can be observed that the NVDA’s share price experienced a generally upward trend, with some fluctuation. Here are the trends in detail:

Starting from June 23, 2023, the share price was $428.74.

By the end of June 2023, there was a slight decrease to $413.50.

In July 2023, the share price saw an increment, hitting a high at $461.01 on July 21.

During the first two weeks of August 2023, there was a slight decrease, and the price dropped to $433.02 by August 11.

Following this drop, there was a quick rebound, and the price peaked at $483.83 by September 1, 2023.

The rest of September 2023 was characterized by a downward trend, reaching a low point at $426.26 by the end of the month.

In October 2023, the trend started picking up again, reaching a value of $460.56 by mid-month, followed by a downfall to end at $418.70 by the end.

November saw a swift rise to a high of $491.72 by the end of the month.

In the first two weeks of December 2023, the share price experienced a small oscillation, finally settling at $474.96 on December 14, 2023.

Overall, over a span of about six months, the share price increased while experiencing several up and down fluctuations but without any clear accelerating or decelerating trends. In general, trends seem moderately volatile. Here is a chart of NVDA’s price over the past 180 days.

Unveiling NVIDIA Corporation’s Strong Performance: Growth, Quality, and Sentiment Analysis

NVDA has an overall C rating, translating to a Neutral in our POWR Ratings system. It is ranked #29 out of the 91 stocks in the Semiconductor & Wireless Chip category.

Based on the POWR Ratings, the three most noteworthy dimensions for NVDA are Growth, Quality, and Sentiment.

In the Growth dimension, NASA’s rating dramatically improved from 72 in June 2023 to a peak of 99 consistently from September 2023 onwards. The trend suggests a significant improvement in this dimension over the covered period.

On the Quality aspect, NVDA maintained high ratings, starting at 91 in June 2023 and eventually rising to a steady 95 by September 2023.

Lastly, the Sentiment dimension shows a consistently high trend throughout, starting at 94 in June 2023 and reaching its peak at 98 multiple times from September 2023 onwards.

These high ratings suggest that NVIDIA Corporation is demonstrating strong growth potential and maintaining exceptional quality and positive sentiment throughout the given time period.

How does NVIDIA Corporation (NVDA) Stack Up Against its Peers?

Other stocks in the Semiconductor & Wireless Chip sector that may be worth considering are ChipMOS TECHNOLOGIES INC. (IMOS), Everspin Technologies Inc. (MRAM), and STMicroelectronics N.V. (STM) — they have better POWR Ratings.

What To Do Next?

Discover 10 widely held stocks that our proprietary model shows have tremendous downside potential. Please make sure none of these “death trap” stocks are lurking in your portfolio:

10 Stocks to SELL NOW! >

NVDA shares rose $0.72 (+0.15%) in premarket trading Friday. Year-to-date, NVDA has gained 231.03%, versus a 24.28% rise in the benchmark S&P 500 index during the same period.

About the Author: Subhasree Kar

Subhasree’s keen interest in financial instruments led her to pursue a career as an investment analyst. After earning a Master’s degree in Economics, she gained knowledge of equity research and portfolio management at Finlatics. More...

More Resources for the Stocks in this Article","(technology, product manufacturer, nvidia)
(nvidia, supplier-customer, ai developers)
(nvidia, supplier-customer, ai industry)
(nvidia, manufacturer, ai chips)
(nvidia, competitors, chipmos technologies inc.)
(nvidia, competitors, everspin technologies inc.)
(nvidia, competitors, stmicroelectronics n.v.)","{""SECTOR"": [""Technology""], ""COMPANY"": [""NVIDIA Corporation (NVDA)"", ""ChipMOS TECHNOLOGIES INC. (IMOS)"", ""Everspin Technologies Inc. (MRAM)"", ""STMicroelectronics N.V. (STM)""], ""PEOPLE"": [""Not mentioned in the text""], ""PRODUCTS"": [""Not mentioned in the text""]}","{""title"": ""NVDA: Should Investors Seize the Dip in NVIDIA Corporation (NVDA)?"", ""publisher"": ""StockNews.com"", ""authors"": NaN, ""published_date"": NaN}"
